TABLE_CATALOG,TABLE_SCHEMA,TABLE_NAME,COLUMN_NAME,ORDINAL_POSITION,COLUMN_DEFAULT,IS_NULLABLE,DATA_TYPE,CHARACTER_MAXIMUM_LENGTH,CHARACTER_OCTET_LENGTH,NUMERIC_PRECISION,NUMERIC_PRECISION_RADIX,NUMERIC_SCALE,DATETIME_PRECISION,INTERVAL_TYPE,INTERVAL_PRECISION,CHARACTER_SET_CATALOG,CHARACTER_SET_SCHEMA,CHARACTER_SET_NAME,COLLATION_CATALOG,COLLATION_SCHEMA,COLLATION_NAME,DOMAIN_CATALOG,DOMAIN_SCHEMA,DOMAIN_NAME,UDT_CATALOG,UDT_SCHEMA,UDT_NAME,SCOPE_CATALOG,SCOPE_SCHEMA,SCOPE_NAME,MAXIMUM_CARDINALITY,DTD_IDENTIFIER,IS_SELF_REFERENCING,IS_IDENTITY,IDENTITY_GENERATION,IDENTITY_START,IDENTITY_INCREMENT,IDENTITY_MAXIMUM,IDENTITY_MINIMUM,IDENTITY_CYCLE,IDENTITY_ORDERED,SCHEMA_EVOLUTION_RECORD,COMMENT
FINANCIAL__ECONOMIC_ESSENTIALS,CYBERSYN,GEOGRAPHY_RELATIONSHIPS,GEO_NAME,1,,YES,TEXT,16777216,16777216,,,,,,,,,,,,,,,,,,,,,,,,NO,NO,,,,,,,,,Full name of the place
FINANCIAL__ECONOMIC_ESSENTIALS,CYBERSYN,GEOGRAPHY_RELATIONSHIPS,RELATED_GEO_NAME,4,,YES,TEXT,16777216,16777216,,,,,,,,,,,,,,,,,,,,,,,,NO,NO,,,,,,,,,"Name of the place related to GEO_NAME. This is a place that overlaps or is contained within the primary geo (e.g., city within a state)"
FINANCIAL__ECONOMIC_ESSENTIALS,CYBERSYN,GEOGRAPHY_RELATIONSHIPS,GEO_ID,2,,YES,TEXT,16777216,16777216,,,,,,,,,,,,,,,,,,,,,,,,NO,NO,,,,,,,,,A unique identifier for a place joinable to the GEOGRAPHY_INDEX table
FINANCIAL__ECONOMIC_ESSENTIALS,CYBERSYN,GEOGRAPHY_RELATIONSHIPS,RELATED_GEO_ID,5,,YES,TEXT,16777216,16777216,,,,,,,,,,,,,,,,,,,,,,,,NO,NO,,,,,,,,,A unique identifier for the related place joinable to the GEOGRAPHY_INDEX table
FINANCIAL__ECONOMIC_ESSENTIALS,CYBERSYN,GEOGRAPHY_RELATIONSHIPS,LEVEL,3,,YES,TEXT,16777216,16777216,,,,,,,,,,,,,,,,,,,,,,,,NO,NO,,,,,,,,,"Geographic level or hierarchy (e.g., Country, State, County, City, Continent, CountrySubRegion, etc.)"
FINANCIAL__ECONOMIC_ESSENTIALS,CYBERSYN,GEOGRAPHY_RELATIONSHIPS,RELATIONSHIP_TYPE,7,,YES,TEXT,16777216,16777216,,,,,,,,,,,,,,,,,,,,,,,,NO,NO,,,,,,,,,"Relationship between the two places. Contains means the RELATED_GEO_ID is fully contained within the GEO_ID (e.g., relationship of state to a city) while Overlaps indicates the GEO_ID is a subpart of the RELATED_GEO_ID (e.g., relationship of city to a state)"
FINANCIAL__ECONOMIC_ESSENTIALS,CYBERSYN,GEOGRAPHY_RELATIONSHIPS,RELATED_LEVEL,6,,YES,TEXT,16777216,16777216,,,,,,,,,,,,,,,,,,,,,,,,NO,NO,,,,,,,,,"Geographic level or hierarchy of the related place (e.g., Country, State, County, City, Continent, CountrySubRegion, etc.)"
